{
  "$schema": "https://json-schema.org/draft/2020-12/schema",
  "$id": "https://csi-platform.local/applens-llm/workload-profile.schema.json",
  "title": "AppLens-LLM Workload Profile",
  "type": "object",
  "additionalProperties": false,
  "required": [
    "schema_version",
    "workload_id",
    "display_name",
    "workload_type",
    "program_file",
    "commands_file",
    "metrics_file",
    "probes_file",
    "evals_dir",
    "schemas_dir",
    "allowed_actions",
    "blocked_actions",
    "required_artifacts",
    "model_role_needs",
    "safety_gates"
  ],
  "properties": {
    "schema_version": { "type": "string", "const": "0.1" },
    "workload_id": { "type": "string", "pattern": "^[a-z][a-z0-9_.-]*$" },
    "display_name": { "type": "string", "minLength": 1 },
    "workload_type": { "type": "string", "minLength": 1 },
    "program_file": { "type": "string", "minLength": 1 },
    "commands_file": { "type": "string", "minLength": 1 },
    "metrics_file": { "type": "string", "minLength": 1 },
    "probes_file": { "type": "string", "minLength": 1 },
    "evals_dir": { "type": "string", "minLength": 1 },
    "schemas_dir": { "type": "string", "minLength": 1 },
    "allowed_actions": {
      "type": "array",
      "minItems": 1,
      "items": { "type": "string", "minLength": 1 },
      "uniqueItems": true
    },
    "blocked_actions": {
      "type": "array",
      "minItems": 1,
      "items": { "type": "string", "minLength": 1 },
      "uniqueItems": true
    },
    "required_artifacts": {
      "type": "array",
      "minItems": 1,
      "items": { "type": "string", "minLength": 1 },
      "uniqueItems": true
    },
    "model_role_needs": {
      "type": "array",
      "minItems": 1,
      "items": {
        "type": "object",
        "additionalProperties": false,
        "required": ["role", "capabilities"],
        "properties": {
          "role": { "type": "string", "minLength": 1 },
          "capabilities": {
            "type": "array",
            "minItems": 1,
            "items": { "type": "string", "minLength": 1 },
            "uniqueItems": true
          }
        }
      }
    },
    "safety_gates": {
      "type": "object",
      "additionalProperties": false,
      "required": [
        "requires_self_fit",
        "allow_network",
        "allow_writes_outside_workload_root",
        "allow_live_trading"
      ],
      "properties": {
        "requires_self_fit": { "type": "boolean" },
        "allow_network": { "type": "boolean" },
        "allow_writes_outside_workload_root": { "type": "boolean", "const": false },
        "allow_live_trading": { "type": "boolean", "const": false }
      }
    }
  }
}
